{
  "$schema": "https://json-schema.org/draft/2020-12/schema",
  "$id": "https://irrevon.dev/schemas/bench-environment.schema.json",
  "$comment": "irrevonbench/environment/v1 (preregistration §8 environment manifest) — proposed by ADR-0030. Captured once per run; the run manifest pins its digest. Environment drift between paired runs is a reportable integrity signal. Container pinning (base + digest) is a Stage-B mechanism choice (§0 checklist); the fields exist now so the capture code is exercised before it matters. $id host is a placeholder (ADR-0023). Shape changes require an ADR.",
  "title": "IrrevonBench environment manifest",
  "type": "object",
  "properties": {
    "format": { "const": "irrevonbench/environment/v1" },
    "captured_at": { "type": "string", "format": "date-time" },
    "python": {
      "type": "object",
      "properties": {
        "version": { "type": "string", "minLength": 1 },
        "implementation": { "type": "string", "minLength": 1 }
      },
      "required": ["version", "implementation"],
      "additionalProperties": false
    },
    "platform": {
      "type": "object",
      "properties": {
        "system": { "type": "string", "minLength": 1 },
        "release": { "type": "string", "minLength": 1 },
        "machine": { "type": "string", "minLength": 1 }
      },
      "required": ["system", "release", "machine"],
      "additionalProperties": false
    },
    "packages": {
      "description": "Installed distributions relevant to the harness (name, version), sorted by name.",
      "type": "array",
      "items": {
        "type": "object",
        "properties": {
          "name": { "type": "string", "minLength": 1 },
          "version": { "type": "string", "minLength": 1 }
        },
        "required": ["name", "version"],
        "additionalProperties": false
      }
    },
    "lockfile_sha256": {
      "description": "sha256 of uv.lock when resolvable from the repository; null in installed-package contexts.",
      "type": ["string", "null"],
      "pattern": "^[0-9a-f]{64}$"
    },
    "git": {
      "type": ["object", "null"],
      "properties": {
        "commit": { "type": "string", "pattern": "^[0-9a-f]{7,40}$" },
        "dirty": { "type": "boolean" }
      },
      "required": ["commit", "dirty"],
      "additionalProperties": false
    },
    "container": {
      "description": "Pinned container identity when running containerized (Stage-B mechanism); null on bare metal.",
      "type": ["object", "null"],
      "properties": {
        "image": { "type": "string", "minLength": 1 },
        "digest": { "type": "string", "minLength": 1 }
      },
      "required": ["image", "digest"],
      "additionalProperties": false
    },
    "test_hooks_armed": {
      "description": "Must be false: IRREVON_TEST_HOOKS with IRREVON_BENCH is a startup error (testhooks arming rule); recorded so the invariant is auditable per run.",
      "type": "boolean"
    }
  },
  "required": [
    "format",
    "captured_at",
    "python",
    "platform",
    "packages",
    "lockfile_sha256",
    "git",
    "container",
    "test_hooks_armed"
  ],
  "additionalProperties": false
}
