{
  "format": "irrevonbench/environment/v1",
  "captured_at": "2026-07-22T00:00:30Z",
  "python": {
    "version": "3.13.5",
    "implementation": "CPython"
  },
  "platform": {
    "system": "Darwin",
    "release": "25.5.0",
    "machine": "arm64"
  },
  "packages": [
    { "name": "jsonschema", "version": "4.25.0" },
    { "name": "psycopg", "version": "3.3.4" },
    { "name": "rfc8785", "version": "0.1.4" }
  ],
  "lockfile_sha256": "0f1e2d3c4b5a69788796a5b4c3d2e1f00f1e2d3c4b5a69788796a5b4c3d2e1f0",
  "git": {
    "commit": "a994963",
    "dirty": false
  },
  "container": null,
  "test_hooks_armed": false
}
